<?xml version="1.0" encoding="UTF-8"?>
<!DOCTYPE doc SYSTEM "../dtd/SimpleDoc.dtd">
<doc toc="true" toclevel="3" cover="true" xmlns:fo="http://www.w3.org/1999/XSL/Format" lang="en">
<head>
<date>July, 2005<br/>2nd Edition</date>
<author logo="img/ahlogo.svg" width="41.54mm" height="8.73mm">Antenna House, Inc.<br/>Copyright &#x00a9; 2001-2007 Antenna House, Inc.</author>
<abstract>This tutorial explains the way to edit XSL stylesheet that transforms XML document file into XSL-FO.</abstract>
<title>How to Develop Stylesheet<br/>for XML to XSL-FO Transformation</title>
</head>
<body>
<section logo="img/ico4.png">
<title>Preface</title>
<p>
Extensible Stylesheet Language (XSL)<ref ref-id="a1"/> has been brought to the attention of a wide audience as a specification recommended by W3C on 15th October, 2001 for displaying and printing the XML document. The following is the general process to transform the XML document into XSL Formatting Objects (XSL-FO) and print it.
</p>
<ol>
<li>Develop the stylesheet that conforms to the DTD of the source XML document to create the target output.</li>
<li>Input the XML document and the XSL stylesheet to the XSLT processor to create XSL-FO.</li>
<li> Get the target outputs such as paper-based output, PDF output, by the XSL-FO processor.</li>
</ol>
<p/>
<figure src="img/XSL-FO_proc.emf">
<title>Generating XSL-FO and Display/Print by XSL Formatter</title>
</figure>
<p>
The knowledge about XSLT and XSL is necessary to develop XSLT stylesheet. The knowledge about XSLT and XSL is necessary to develop XSLT stylesheet. As for XSLT, many reference books has been published other than the specification<ref ref-id="a2"/>.
Probably, XSLT is already much more familiar one, since it is often used for the conversion from XML to HTML.
The XSL specification <ref ref-id="a1"/>has a huge amount of contents, it has over 400 pages. It is pretty hard to understand this specification. But basically it is intended for implementers. It is not necessary for XSLT stylesheet designers to understand everything. You can fully write stylesheet by knowing some regular contents and patterns.
</p>
<p>
This report explains how to edit stylesheet which is used for transforming XML documents into XSL-FO according to the example of <index>SimpleDoc</index>. SimpleDoc is made for this report as a format to write a simple document. This is based on <index>PureSmartDoc</index>
<ref ref-id="a4"/> presented by Tomoharu Asami.
To make it a simple, the number of the elements is reduced and the useful functions for writing and formatting documents are added.
</p>
<p>This report explains how to edit a stylesheet which is used for transforming a SimpleDoc document into XSL-FO. This report itself is the instance XML document of SimpleDoc.dtd, and it is then ready to be formatted by Antenna House <index>XSL Formatter</index> with the stylesheet which transforms the SimpleDoc document explained here into XSL-FO.
</p>
</section>
<section logo="img/ico4.png">
<title>Step for XSL-FO Transformation </title>
<p>Now, what steps are necessary to develop XSL stylesheet?  These steps are explained briefly as below.</p>
<table layout="fixed">
<col number="1" width="30%"/>
<col number="2" width="70%"/>
<thead>
<tr>
<th align="center">Steps</th>
<th align="center">Contents</th>
</tr>
</thead>
<tbody>
<tr>
<td>
Know the structure of the XML document</td>
<td>First, the information about the structure of XML source documents is required. XSLT processor can transform XML document into XSL-FO without a DTD. But the information described in the DTD such as types of elements, contents of elements, appearing order of elements and values of properties are necessary for developing a stylesheet.

</td>
</tr>
<tr>
<td>Specify a printing form
</td>
<td>
This is the printing form as a final output, in other words the output specification. XSL is a formatting specification.  Printing forms has various range of specifications such as sizes and layouts of printing paper, layouts of head and body, deciding whether or not to output index, table of contents, and so on.
</td>
</tr>
<tr>
<td>Apply a printing form to formatting objects</td>
<td>After determining the specification of printing, you have to know what XSL formatting objects and properties are applied in order to print in this style. It is better to practice how to specify by referring to a simple stylesheet. </td>
</tr>
<tr>
<td>Develop an XSL stylesheet</td>
<td>Put the instructions to the stylesheet in order to transform XML source documents into the target printing form. Map the XML source document to XSL formatting objects that can generate the output specification. The stylesheet have the similar aspect as the general programming languages, while it may be difficult if you do not understand the feature of the XSL.  <note>Refer to the definition list template in this report. In XSL, Structure for control of the conditional branch can be made, but it is impossible to assign a value to a variable. The technique to realize by calling loops recursively is necessary.</note>
</td>
</tr>
</tbody>
</table>
</section>
<section logo="img/ico4.png">
<title>SimpleDoc Organization
</title>
<p>
The following table shows the structure of SimpleDoc treated in this report. For more detail, refer to SimpleDoc.dtd.</p>
<table rowheight="2em">
<col number="1" width="17.5%"/>
<col number="2" width="22.5%"/>
<col number="3" width="60%"/>
<thead>
<tr height="1em">
<th> Element</th>
<th> Meaning</th>
<th>Definition</th>
</tr>
</thead>
<tbody>
<tr>
<td>
a group of block elements
</td>
<td>&#x2014;</td>
<td>p | figure | ul | ol | dl | table | program | div</td>
</tr>
<tr>
<td>

a group of inline elements
<br/>
</td>
<td>&#x2014;</td>
<td>a | note | span | b | i | em | code | br
</td>
</tr>
<tr>
<td>doc<br/>
</td>
<td> root element </td>
<td>(head, body)</td>
</tr>
<tr>
<td>head<br/>
</td>
<td> header</td>
<td>(date | author | abstract | title)*</td>
</tr>
<tr>
<td>date, author, abstract, title<br/>
</td>
<td> header elements,<br/> date, author, abstract, title</td>
<td>
(#PCDATA | a group of inline elements)*
</td>
</tr>
<tr>
<td>body</td>
<td> body</td>
<td>
(chapter | part | section | a group of block elements | a group of inline elements)*
</td>
</tr>
<tr>
<td>part</td>
<td>part</td>
<td>(title, (chapter |a group of block elements | a group of inline elements)*)</td>
</tr>
<tr>
<td>chapter</td>
<td>chapter</td>
<td>(title, (section | a group of bock elements | a group of inline elements)*)
</td>
</tr>
<tr>
<td>section</td>
<td> section</td>
<td>(title, (subsection | a group of block elements | a group of inline elements)*)
</td>
</tr>
<tr>
<td>subsection</td>
<td> subsection</td>
<td>
(title, (subsubsection | a group of block elements | a group of inline elements)*)
</td>
</tr>
<tr>
<td>subsubsection</td>
<td>subsubsection</td>
<td>
(title, (a group of block elements | a group of inline elements)*)
</td>
</tr>
<tr>
<td>title</td>
<td> title</td>
<td>
(#PCDATA | a group of inline elements)*
</td>
</tr>
<tr>
<td>p<br/>
</td>
<td> paragraph</td>
<td>
(#PCDATA | a group of block elements | a group of inline elements)*

</td>
</tr>
<tr>
<td>figure<br/>
</td>
<td>figure</td>
<td>(title?)<br/>
Specify a file by the src property.</td>
</tr>
<tr>
<td>ul<br/>
</td>
<td>
unordered list

</td>
<td>(li*)<br/>
Specify a character for label of line by the type property.

</td>
</tr>
<tr>
<td>ol<br/>
</td>
<td>
ordered list </td>
<td>(li*)<br/>
Specify format of number in the label by the type property.
</td>
</tr>
<tr>
<td>dl<br/>
</td>
<td>
definition list</td>
<td>(dt, dd)*<br/>
Specify whether to format the block in horizontal way or in vertical way by the type property.
</td>
</tr>
<tr>
<td>dt<br/>
</td>
<td>
definition term
</td>
<td>(#PCDATA | a group of block elements | a group of inline elements)*
</td>
</tr>
<tr>
<td>dd<br/>
</td>
<td>description of details
</td>
<td>
(#PCDATA | a group of block elements | a group of inline elements)*
</td>
</tr>
<tr>
<td>table<br/>
</td>
<td>
entire table
</td>
<td>(title?, col*, thead?, tfoot?, tbody)<br/>
Specify whether to make auto layout or fixed by the layout property. Specify the width of the entire table by the width property.
</td>
</tr>
<tr>
<td>col<br/>
</td>
<td>
column format
</td>
<td>EMPTY<br/>
Speciry the number of the column by the number property, the width of the column by the width property.
</td>
</tr>
<tr>
<td>thead</td>
<td>
table header
</td>
<td>(tr*)</td>
</tr>
<tr>
<td>tfoot</td>
<td>
table footer
</td>
<td>(tr*)</td>
</tr>
<tr>
<td>tbody</td>
<td>table body
</td>
<td>(tr*)</td>
</tr>
<tr>
<td>tr</td>
<td>
table row</td>
<td>(th | td)*<br/>Specify the height of the row by the height property.</td>
</tr>
<tr>
<td>th</td>
<td>
table header
</td>
<td>(#PCDATA | a group of inline elements | a group of block elements)*<br/>
Specify the number of the columns to be expanded across, the number of the rows to be expanded vertically by the colspan and rowspan properties. The align property allows horizontal alignment to be set to left, right, or center. The valign property allows vertical alignment to be set to top, middle, bottom or baseline.
</td>
</tr>
<tr>
<td>td</td>
<td>
table data
</td>
<td>(#PCDATA | a group of inline elements | a group of block elements)*<br/>

Specify the number of the columns to be expanded across, the number of the rows to be expanded vertically by the colspan and rowspan properties. The align property allows horizontal alignment to be set to left, right, or center. The valign property allows vertical alignment to be set to top, middle, bottom or baseline.</td>
</tr>
<tr>
<td>program</td>
<td>
program code
</td>
<td>(#PCDATA | title)*</td>
</tr>
<tr>
<td>div</td>
<td>general block element
</td>
<td>
(title, (general block element | general inline element)*)
<br/>
The div element expands the type by the class property.
</td>
</tr>
<tr>
<td>a<br/>
</td>
<td>
anchor(link)
</td>
<td>(#PCDATA | a group of inline elements)*